Author,FileNumber,Title
Martin Luther,31604,"Works of Martin Luther, with Introductions and Notes (Volume I)"
Martin Luther,34904,"Works of Martin Luther, with Introductions and Notes (Volume II)"
Martin Luther,1670,The Small Catechism of Martin Luther
Martin Luther,9841,Selections from the Table Talk of Martin Luther
Martin Luther,1549,Commentary on the Epistle to the Galatians
Martin Luther,1911,"Concerning Christian Liberty
       With Letter Of Martin Luther To Pope Leo X."
Martin Luther,418,A Treatise on Good Works
Martin Luther,48193,"Commentary on Genesis, Vol. I
       Luther on the Creation"
Martin Luther,27978,"Commentary on Genesis, Vol. II
       Luther on Sin and the Flood",,
Martin Luther,272,An Open Letter on Translating
Martin Luther,28464,"Epistle Sermons, Vol. II
       Epiphany, Easter and Pentecost"
Martin Luther,29678,The Epistles of St. Peter and St. Jude Preached and Explained
Martin Luther,30619,"Epistle Sermons, Vol. III
       Trinity Sunday to Advent"
